match,score,mhsaa_name,mhsaa_id,nces_id,mhsaa_popular,mhsaa_proper,nces_proper
U of D Jesuit High School and Academy,100,,,,Detroit U of D Jesuit,U of D Jesuit HS,U of D Jesuit High School and Academy
brighton high school,100,brighton high school,3834,2.61E+11,Brighton,Brighton High School,Brighton High School
high school,90,ewen-trout creek high school,3835,2.62E+11,Ewen-Trout Creek,Ewen-Trout Creek High School,High School
actech high school,86,cherryhill school of performing arts,3836,2.64E+11,Inkster Cherryhill School of Performing Arts,Cherryhill School of Performing Arts,ACTech High School
roseville high school,100,roseville high school,3837,2.63E+11,Roseville,Roseville High School,Roseville High School
shepherd high school,100,shepherd high school,3838,2.63E+11,Shepherd,Shepherd High School,Shepherd High School
cass city jr and sr high school,95,cass city high school,3839,2.61E+11,Cass City,Cass City High School,Cass City Jr and Sr High School
windover high school,92,andover high school,3840,2.60E+11,Bloomfield Hills Andover,Andover High School,Windover High School
high school,90,roeper high school,3841,2.62E+11,Bloomfield Hills Roeper,Roeper High School,High School
high school,90,st francis high school,3842,2.62E+11,Traverse City St Francis,St Francis High School,High School
high school,90,east jordan high school,3843,2.62E+11,East Jordan,East Jordan High School,High School
corunna high school,100,corunna high school,3844,2.61E+11,Corunna,Corunna High School,Corunna High School
arts academy in the woods,100,arts academy in the woods,3845,2.60E+11,Fraser Arts Academy,Arts Academy in the Woods,Arts Academy in the Woods
coloma high school,92,coleman high school,3846,2.61E+11,Coleman,Coleman High School,Coloma High School
academy for business and technology high school,86,westside christian academy,3847,2.60E+11,Detroit Westside Christian,Westside Christian Academy,Academy for Business and Technology High School
high school,90,richmond high school,3848,2.62E+11,Richmond,Richmond High School,High School
maple valley jrsr high school,95,maple valley high school,3849,2.62E+11,Vermontville Maple Valley,Maple Valley High School,Maple Valley JrSr High School
hillsdale academy,100,hillsdale academy,3850,A9103494,Hillsdale Academy,Hillsdale Academy,Hillsdale Academy
cousino senior high school,95,cousino high school,3851,2.64E+11,Warren Cousino,Cousino High School,Cousino Senior High School
summit academy north high school,90,summit academy north,3852,2.60E+11,Romulus Summit Academy North,Summit Academy North,Summit Academy North High School
academic and career education academy,86,charlotte forten academy,3853,2.60E+11,Detroit Charlotte Forten Academy,Charlotte Forten Academy,Academic and Career Education Academy
fowlerville high school,91,walkerville high school,3854,2.61E+11,Walkerville,Walkerville High School,Fowlerville High School
madison high school,100,madison high school,3855,2.62E+11,Madison Heights Madison,Madison High School,Madison High School
academy for business and technology high school,86,west village academy north,3856,2.60E+11,Detroit West Village Academy,West Village Academy North,Academy for Business and Technology High School
forest area high school,91,forest park high school,3857,2.61E+11,Crystal Falls Forest Park,Forest Park High School,Forest Area High School
chandler park academy high school,90,chandler park academy,3858,2.60E+11,Harper Woods Chandler Park,Chandler Park Academy,Chandler Park Academy High School
academic and career education academy,86,academy of inkster,3859,2.60E+11,Inkster Academy,Academy of Inkster,Academic and Career Education Academy
university high school,95,university liggett high school,3860,2.61E+11,Grosse Pointe Woods University Liggett,University Liggett High School,University High School
saginaw arts and sciences academy,95,saginaw arts & sciences academy,3861,2.63E+11,Saginaw Arts & Sciences Academy,Saginaw Arts & Sciences Academy,Saginaw Arts and Sciences Academy
central high school,95,central academy high school,3862,2.61E+11,Ann Arbor Central Academy,Central Academy High School,Central High School
john glenn high school,100,john glenn high school,3863,2.60E+11,Bay City John Glenn,John Glenn High School,John Glenn High School
paw paw high school,100,paw paw high school,3864,2.63E+11,Paw Paw,Paw Paw High School,Paw Paw High School
high school,90,black river high school,3865,2.62E+11,Holland Black River,Black River High School,High School
bridgeport high school,100,bridgeport high school,3866,2.61E+11,Bridgeport,Bridgeport High School,Bridgeport High School
academic and career education academy,86,concord academy boyne,3867,2.60E+11,Boyne City Concord Academy,Concord Academy Boyne,Academic and Career Education Academy
coldwater high school,100,coldwater high school,3868,2.61E+11,Coldwater,Coldwater High School,Coldwater High School
southeastern high school,100,southeastern high school,3869,2.60E+11,Detroit Southeastern,Southeastern High School,Southeastern High School
kingsley area high school,100,kingsley area high school,3870,2.62E+11,Kingsley,Kingsley Area High School,Kingsley Area High School
lakeland high school,100,lakeland high school,3871,2.62E+11,White Lake Lakeland,Lakeland High School,Lakeland High School
high school,90,homer high school,3873,2.62E+11,Homer,Homer High School,High School
crossroads charter academy 712,95,crossroads charter academy,3874,2.60E+11,Big Rapids Crossroads Academy,Crossroads Charter Academy,Crossroads Charter Academy 712
laingsburg high school,100,laingsburg high school,3875,2.62E+11,Laingsburg,Laingsburg High School,Laingsburg High School
high school,90,bradford academy high school,3876,2.62E+11,Southfield Bradford Academy,Bradford Academy High School,High School
berrien springs high school,100,berrien springs high school,3877,2.61E+11,Berrien Springs,Berrien Springs High School,Berrien Springs High School
dewitt high school,100,dewitt high school,3878,2.61E+11,DeWitt,DeWitt High School,DeWitt High School
bad axe high school,100,bad axe high school,3879,2.60E+11,Bad Axe,Bad Axe High School,Bad Axe High School
fitzgerald senior high school,95,fitzgerald high school,3880,2.61E+11,Warren Fitzgerald,Fitzgerald High School,Fitzgerald Senior High School
academy for business and technology high school,86,academy of health & science,3881,2.60E+11,Academy of Health & Science,Academy of Health & Science,Academy for Business and Technology High School
everett high school,100,everett high school,3882,2.62E+11,Lansing Everett,Everett High School,Everett High School
high school,95,ubly high school,3883,2.62E+11,Ubly,Ubly High School,High School
wayne memorial high school,100,wayne memorial high school,3884,2.60E+11,Wayne Memorial,Wayne Memorial High School,Wayne Memorial High School
hamilton high school,100,hamilton high school,3885,2.62E+11,Hamilton,Hamilton High School,Hamilton High School
interlochen arts academy,100,interlochen arts academy,3886,643879,Interlochen,Interlochen Arts Academy,Interlochen Arts Academy
portage central high school,100,portage central high school,3887,2.63E+11,Portage Central,Portage Central High School,Portage Central High School
catholic central high school,95,muskegon catholic central high school,3888,638621,Muskegon Catholic Central,Muskegon Catholic Central High School,Catholic Central High School
columbia central high school,100,columbia central high school,3889,2.61E+11,Brooklyn Columbia Central,Columbia Central High School,Columbia Central High School
high school,90,mt carmel high school,3890,2.62E+11,Wyandotte Mt Carmel,Mt Carmel High School,High School
whittemoreprescott jrsr high school,91,whittemore-prescott high school,3891,2.64E+11,Whittemore-Prescott,Whittemore-Prescott High School,WhittemorePrescott JrSr High School
niles senior high school,95,niles high school,3892,2.63E+11,Niles,Niles High School,Niles Senior High School
mumford high school,100,mumford high school,3893,2.60E+11,Detroit Mumford,Mumford High School,Mumford High School
central high school,90,mason county central high school,3894,2.61E+11,Mason County Central,Mason County Central High School,Central High School
bishop foley catholic high school,100,bishop foley catholic high school,3895,637209,Madison Heights Bishop Foley,Bishop Foley Catholic High School,Bishop Foley Catholic High School
academic and career education academy,86,lakeshore public academy,3896,2.60E+11,Hart Lakeshore Academy,Lakeshore Public Academy,Academic and Career Education Academy
grosse ile high school,100,grosse ile high school,3897,2.62E+11,Grosse Ile,Grosse Ile High School,Grosse Ile High School
deltonkellogg high school,98,delton kellogg high school,3898,2.61E+11,Delton Kellogg,Delton Kellogg High School,DeltonKellogg High School
pittsford area high school,95,pittsford high school,3899,2.63E+11,Pittsford,Pittsford High School,Pittsford Area High School
community high school,95,colon community high school,3900,2.60E+11,Colon,Colon Community High School,Community High School
oscoda area high school,95,oscoda high school,3901,2.63E+11,Oscoda,Oscoda High School,Oscoda Area High School
rogers city high school,100,rogers city high school,3902,2.63E+11,Rogers City,Rogers City High School,Rogers City High School
marine city high school,100,marine city high school,3903,2.61E+11,Marine City,Marine City High School,Marine City High School
high school,90,bethesda christian high school,3904,2.62E+11,Sterling Heights Bethesda Christian,Bethesda Christian High School,High School
big rapids high school,100,big rapids high school,3905,2.61E+11,Big Rapids,Big Rapids High School,Big Rapids High School
vicksburg high school,100,vicksburg high school,3906,2.63E+11,Vicksburg,Vicksburg High School,Vicksburg High School
academy for business and technology high school,86,weston preparatory academy,3907,2.60E+11,Detroit Weston Preparatoy Academy,Weston Preparatory Academy,Academy for Business and Technology High School
university high school,100,university high school,3908,2.61E+11,Ferndale University,University High School,University High School
trenton high school,100,trenton high school,3909,2.63E+11,Trenton,Trenton High School,Trenton High School
clinton high school,100,clinton high school,3910,2.61E+11,Clinton,Clinton High School,Clinton High School
high school,90,st martin de porres high school,3911,2.62E+11,Detroit St Martin dePorres,St Martin De Porres High School,High School
chelsea high school,100,chelsea high school,3912,2.61E+11,Chelsea,Chelsea High School,Chelsea High School
academic and career education academy,86,countryside academy,3913,2.60E+11,Benton Harbor Countryside Academy,Countryside Academy,Academic and Career Education Academy
high school,90,algonac high school,3914,2.62E+11,Algonac,Algonac High School,High School
centreville jr sr high school,95,centreville high school,3915,2.61E+11,Centreville,Centreville High School,Centreville Jr Sr High School
robichaud senior high school,95,robichaud high school,3916,2.61E+11,Dearborn Heights Robichaud,Robichaud High School,Robichaud Senior High School
madison high school,100,madison high school,3917,2.62E+11,Adrian Madison,Madison High School,Madison High School
tawas area high school,100,tawas area high school,3918,2.63E+11,Tawas,Tawas Area High School,Tawas Area High School
54th street academy,86,centerpoint christian academy,3919,2.62E+11,Burton CenterPoint Christian,CenterPoint Christian Academy,54th Street Academy
high school,90,carney-nadeau high school,3920,2.62E+11,Carney-Nadeau,Carney-Nadeau High School,High School
central high school,95,central montcalm high school,3921,2.61E+11,Central Montcalm,Central Montcalm High School,Central High School
high school,90,boyne falls high school,3922,2.62E+11,Boyne Falls,Boyne Falls High School,High School
troy high school,100,troy high school,3923,2.63E+11,Troy,Troy High School,Troy High School
actech high school,86,whitefish township community school,3924,2.64E+11,Paradise Whitefish Township,Whitefish Township Community School,ACTech High School
marshall high school,95,marshall academy high school,3925,2.62E+11,Marshall Academy,Marshall Academy High School,Marshall High School
chesaning union high school,95,chesaning high school,3926,2.61E+11,Chesaning,Chesaning High School,Chesaning Union High School
laker high school,91,lahser high school,3927,2.61E+11,Bloomfield Hills Lahser,Lahser High School,Laker High School
elk rapids high school,100,elk rapids high school,3928,2.61E+11,Elk Rapids,Elk Rapids High School,Elk Rapids High School
warren woods tower high school,100,warren woods-tower high school,3929,2.64E+11,Warren Woods Tower,Warren Woods-Tower High School,Warren Woods Tower High School
high school,90,michigan lutheran high school,3930,2.62E+11,St Joseph Michigan Lutheran,Michigan Lutheran High School,High School
shelby high school,100,shelby high school,3931,2.63E+11,Shelby,Shelby High School,Shelby High School
huron high school,100,huron high school,3932,2.60E+11,Ann Arbor Huron,Huron High School,Huron High School
novi high school,100,novi high school,3933,2.63E+11,Novi,Novi High School,Novi High School
croswelllexington high school,98,croswell-lexington high school,3934,2.61E+11,Croswell-Lexington,Croswell-Lexington High School,CroswellLexington High School
academy for business and technology high school,86,morey public school academy,3935,2.60E+11,Shepherd Morey Public School,Morey Public School Academy,Academy for Business and Technology High School
high school,90,lansing christian high school,3936,2.62E+11,Lansing Christian,Lansing Christian High School,High School
high school,90,murray-wright high school,3937,2.62E+11,Detroit Murray-Wright,Murray-Wright High School,High School
chippewa valley high school,100,chippewa valley high school,3938,2.61E+11,Clinton Township Chippewa Valley,Chippewa Valley High School,Chippewa Valley High School
high school,90,finney high school,3939,2.62E+11,Detroit Finney,Finney High School,High School
eastpointe high school,100,eastpointe high school,3940,2.61E+11,Eastpointe,Eastpointe High School,Eastpointe High School
academy for business and technology high school,86,academy for business & tech,3941,2.60E+11,Melvindale Academy for Business & Tech,Academy for Business & Tech,Academy for Business and Technology High School
st patrick school,95,st patrick high school,3942,A0105062,Portland St Patrick,St Patrick High School,St Patrick School
huron high school,100,huron high school,3943,2.60E+11,New Boston Huron,Huron High School,Huron High School
sand creek high school,100,sand creek high school,3944,2.63E+11,Sand Creek,Sand Creek High School,Sand Creek High School
high school,90,ecorse high school,3945,2.62E+11,Ecorse,Ecorse High School,High School
central high school,95,north central high school,3946,2.61E+11,Powers North Central,North Central High School,Central High School
athens high school,100,athens high school,3947,2.63E+11,Troy Athens,Athens High School,Athens High School
eau claire high school,100,eau claire high school,3948,2.61E+11,Eau Claire,Eau Claire High School,Eau Claire High School
high school,90,pickford high school,3949,2.62E+11,Pickford,Pickford High School,High School
ferndale high school,100,ferndale high school,3950,2.61E+11,Ferndale,Ferndale High School,Ferndale High School
cadillac heritage christian school,86,family altar christian,3951,2038906,Battle Creek Family Altar Christian,Family Altar Christian,Cadillac Heritage Christian School
comstock park high school,100,comstock park high school,3952,2.61E+11,Comstock Park,Comstock Park High School,Comstock Park High School
academic and career education academy,86,universal academy,3953,2.60E+11,Detroit Universal Academy,Universal Academy,Academic and Career Education Academy
gull lake high school,90,glen lake high school,3954,2.62E+11,Maple City Glen Lake,Glen Lake High School,Gull Lake High School
high school,90,l'anse creuse high school,3955,2.62E+11,Harrison Township L'Anse Creuse,L'Anse Creuse High School,High School
high school,90,chassell high school,3956,2.62E+11,Chassell,Chassell High School,High School
skyline high school,100,skyline high school,3957,2.60E+11,Ann Arbor Skyline,Skyline High School,Skyline High School
west side academy of information technology and cyber securi,86,mich inst for const trades & technology,3958,2.60E+11,Detroit Construction Trades,Mich Inst for Const Trades & Technology,West Side Academy of Information Technology and Cyber Securi
redford union high school,100,redford union high school,3959,2.63E+11,Redford Union,Redford Union High School,Redford Union High School
river rouge high school,100,river rouge high school,3960,2.63E+11,River Rouge,River Rouge High School,River Rouge High School
high school,90,cedarville high school,3961,2.62E+11,Cedarville,Cedarville High School,High School
dexter high school,100,dexter high school,3962,2.61E+11,Dexter,Dexter High School,Dexter High School
high school,90,the potter's house christian high school,3963,2.62E+11,Wyoming Potter's House Christian,The Potter's House Christian High School,High School
webberville high school,95,webberville community high school,3964,2.64E+11,Webberville,Webberville Community High School,Webberville High School
high school,90,buena vista high school,3965,2.62E+11,Saginaw Buena Vista,Buena Vista High School,High School
gobles high school,100,gobles high school,3966,2.62E+11,Gobles,Gobles High School,Gobles High School
hh dow high school,100,hh dow high school,3967,2.62E+11,Midland Dow,HH Dow High School,HH Dow High School
high school,90,summerfield high school,3968,2.62E+11,Petersburg Summerfield,Summerfield High School,High School
mason high school,100,mason high school,3969,2.62E+11,Mason,Mason High School,Mason High School
lakeview high school,100,lakeview high school,3970,2.62E+11,St Clair Shores Lakeview,Lakeview High School,Lakeview High School
high school,90,river valley high school,3971,2.62E+11,Three Oaks River Valley,River Valley High School,High School
clintondale high school,100,clintondale high school,3972,2.61E+11,Clinton Township Clintondale,Clintondale High School,Clintondale High School
academic and career education academy,86,st thomas more academy,3973,2.60E+11,Burton St Thomas More Academy,St Thomas More Academy,Academic and Career Education Academy
lakeland high school,95,leland high school,3974,2.62E+11,Leland,Leland High School,Lakeland High School
houghton lake jrsr high school,95,houghton lake high school,3975,2.62E+11,Houghton Lake,Houghton Lake High School,Houghton Lake JrSr High School
cabrini high school,100,cabrini high school,3976,637898,Allen Park Cabrini,Cabrini High School,Cabrini High School
iron mountain high school,100,iron mountain high school,3977,2.62E+11,Iron Mountain,Iron Mountain High School,Iron Mountain High School
harrison community high school,100,harrison community high school,3978,2.62E+11,Harrison,Harrison Community High School,Harrison Community High School
international academy,95,international academy of flint,3979,2.68E+11,International Academy of Flint,International Academy of Flint,International Academy
grand blanc community high school,95,grand blanc high school,3980,2.62E+11,Grand Blanc,Grand Blanc High School,Grand Blanc Community High School
high school,90,manistique high school,3981,2.62E+11,Manistique,Manistique High School,High School
gladwin high school,100,gladwin high school,3982,2.62E+11,Gladwin,Gladwin High School,Gladwin High School
allegan high school,100,allegan high school,3983,2.60E+11,Allegan,Allegan High School,Allegan High School
haslett high school,100,haslett high school,3984,2.62E+11,Haslett,Haslett High School,Haslett High School
new buffalo senior high school,95,new buffalo high school,3985,2.63E+11,New Buffalo,New Buffalo High School,New Buffalo Senior High School
adrian high school,100,adrian high school,3986,2.60E+11,Adrian,Adrian High School,Adrian High School
alma senior high school,95,alma high school,3987,2.60E+11,Alma,Alma High School,Alma Senior High School
decatur jr sr high school,95,decatur high school,3988,2.61E+11,Decatur,Decatur High School,Decatur Jr Sr High School
riverside academy,90,dearborn riverside academy-west,3989,2.61E+11,Dearborn Riverside Academy West,Dearborn Riverside Academy-West,Riverside Academy
brother rice high school,100,brother rice high school,3990,A0104221,Bloomfield Hills Brother Rice,Brother Rice High School,Brother Rice High School
flushing high school,100,flushing high school,3991,2.61E+11,Flushing,Flushing High School,Flushing High School
south lake high school,100,south lake high school,3992,2.63E+11,St Clair Shores South Lake,South Lake High School,South Lake High School
ace,90,st ignace high school,3993,2.64E+11,St Ignace,St Ignace High School,ACE
high school,90,east martin christian high school,3994,2.62E+11,East Martin Christian,East Martin Christian High School,High School
high school,90,montrose hill-mccloy high school,3995,2.62E+11,Montrose,Montrose Hill-McCloy High School,High School
st mary's preparatory school,91,st mary preparatory high school,3996,638632,Orchard Lake St Mary's,St Mary Preparatory High School,St Mary'S Preparatory School
mount clemens high school,94,mt clemens high school,3997,2.62E+11,Mount Clemens,Mt Clemens High School,Mount Clemens High School
romulus senior high school,95,romulus high school,3998,2.63E+11,Romulus,Romulus High School,Romulus Senior High School
academic and career education academy,86,trillium academy,3999,2.60E+11,Taylor Trillium Academy,Trillium Academy,Academic and Career Education Academy
hastings high school,100,hastings high school,4000,2.62E+11,Hastings,Hastings High School,Hastings High School
eton academy,90,will carleton academy,4001,AA000474,Hillsdale Will Carleton Academy,Will Carleton Academy,Eton Academy
galesburgaugusta high school,98,galesburg-augusta high school,4002,2.62E+11,Galesburg-Augusta,Galesburg-Augusta High School,GalesburgAugusta High School
austin catholic high school,91,lansing catholic high school,4003,A1301673,Lansing Catholic,Lansing Catholic High School,Austin Catholic High School
grosse pointe south high school,100,grosse pointe south high school,4004,2.63E+11,Grosse Pointe South,Grosse Pointe South High School,Grosse Pointe South High School
milan high school,100,milan high school,4005,2.62E+11,Milan,Milan High School,Milan High School
lutheran high school north,92,lutheran high school south,4006,642059,Newport Lutheran South,Lutheran High School South,Lutheran High School North
hazel park high school,100,hazel park high school,4007,2.62E+11,Hazel Park,Hazel Park High School,Hazel Park High School
bendle high school,100,bendle high school,4008,2.60E+11,Burton Bendle,Bendle High School,Bendle High School
west catholic high school,92,powers catholic high school,4009,639261,Flint Powers Catholic,Powers Catholic High School,West Catholic High School
avondale high school,100,avondale high school,4010,2.60E+11,Auburn Hills Avondale,Avondale High School,Avondale High School
waverly senior high school,95,waverly high school,4011,2.64E+11,Lansing Waverly,Waverly High School,Waverly Senior High School
fremont high school,100,fremont high school,4012,2.62E+11,Fremont,Fremont High School,Fremont High School
vandercook lake high school,100,vandercook lake high school,4013,2.63E+11,Vandercook Lake,Vandercook Lake High School,Vandercook Lake High School
dryden high school,100,dryden high school,4014,2.61E+11,Dryden,Dryden High School,Dryden High School
byron center high school,100,byron center high school,4015,2.61E+11,Byron Center,Byron Center High School,Byron Center High School
high school,90,escanaba high school,4016,2.62E+11,Escanaba,Escanaba High School,High School
high school,90,kent occupational high school,4017,2.62E+11,Grand Rapids Kent Occupational,Kent Occupational High School,High School
grandville calvin christian high school,95,calvin christian high school,4018,643438,Grandville Calvin Christian,Calvin Christian High School,Grandville Calvin Christian High School
lakeview high school,100,lakeview high school,4019,2.62E+11,Battle Creek Lakeview,Lakeview High School,Lakeview High School
kalamazoo christian school,95,kalamazoo christian high school,4020,A1702067,Kalamazoo Christian,Kalamazoo Christian High School,Kalamazoo Christian School
high school,90,gwinn high school,4021,2.62E+11,Gwinn,Gwinn High School,High School
high school,90,gateway high school,4022,2.62E+11,Grand Rapids Gateway,Gateway High School,High School
54th street academy,86,traverse city college prep academy,4023,2.62E+11,Traverse City College Prep Academy,Traverse City College Prep Academy,54th Street Academy
hanoverhorton high school,98,hanover-horton high school,4024,2.62E+11,Hanover-Horton,Hanover-Horton High School,HanoverHorton High School
norway high school,100,norway high school,4025,2.63E+11,Norway,Norway High School,Norway High School
jackson high school,100,jackson high school,4026,2.62E+11,Jackson,Jackson High School,Jackson High School
high school,90,marenisco high school,4027,2.62E+11,Marenisco,Marenisco High School,High School
riverside academy,100,riverside academy,4028,2.61E+11,Detroit Riverside,Riverside Academy,Riverside Academy
high school,90,deerfield high school,4029,2.62E+11,Deerfield,Deerfield High School,High School
stevenson high school,95,utica stevenson high school,4030,2.62E+11,Sterling Heights Stevenson,Utica Stevenson High School,Stevenson High School
covenant christian high school,100,covenant christian high school,4031,643245,Grand Rapids Covenant Christian,Covenant Christian High School,Covenant Christian High School
central high school,100,central high school,4032,2.61E+11,Battle Creek Central,Central High School,Central High School
marquette senior high school,95,marquette high school,4033,2.60E+11,Marquette,Marquette High School,Marquette Senior High School
zion christian school,95,zion christian high school,4034,A0301887,Byron Center Zion Christian,Zion Christian High School,Zion Christian School
